results/model_comparison.csv

ML Model Name,Accuracy,AUC,Precision,Recall,F1,MCC
Logistic Regression,0.9206757253029747,0.9933984516940367,0.9215328435004574,0.9206757253029747,0.9208728071055451,0.9041666634728006
Decision Tree,0.8916636063165626,0.9329623772083053,0.8912470304116911,0.8916636063165626,0.8913219229524194,0.869058835971552
KNN,0.9166360631656262,0.9812466098253438,0.9174092603022151,0.9166360631656262,0.9168048079580466,0.8992035213926259
Naive Bayes,0.7638633859713552,0.9644421096213359,0.7653708847319572,0.7638633859713552,0.7614742997970327,0.7154063217966201
Support Vector Machine,0.9221446933529196,0.9936803481114389,0.9224256521079515,0.9221446933529196,0.9221767190269773,0.9058700549308653

README.md

### 4.2 Observations on Model Performance

Logistic Regression achieved an accuracy of 92.07% and an AUC score of 0.9934. It demonstrated strong classification performance and good separation between bean classes. Its performance was very close to that of the Support Vector Machine.

The Decision Tree achieved an accuracy of 89.17% and an AUC score of 0.9330. Its performance was lower than the other major classification models, indicating comparatively weaker generalization on the testing dataset.

KNN achieved an accuracy of 91.66% and an AUC score of 0.9812. It demonstrated good classification performance, although its results were slightly below Logistic Regression and Support Vector Machine.

Naive Bayes achieved an accuracy of 76.39% and an AUC score of 0.9644. It recorded the lowest accuracy and F1 score among the five models. This suggests that its predicted class labels were comparatively less effective on this dataset.

Support Vector Machine achieved the highest accuracy of 92.21%, AUC of 0.9937, Precision of 0.9224, Recall of 0.9221, F1 Score of 0.9222 and MCC of 0.9059.

## 9. Conclusion

The experimental results show that Support Vector Machine achieved the best overall performance, with 92.21% accuracy and a weighted F1 score of 0.9222.